Title,Genre,Director,Release Year,movie reviews,Done
The Godfather,Crime; Drama,Francis Ford Coppola,1972,"""The reviewer hails The Godfather as a masterpiece that evokes deep nostalgia and joy, reminiscing about family viewings that filled them with excitement and love, making it a timeless emotional anchor in cinema.""",
The Dark Knight,Action; Crime; Drama,Christopher Nolan,2008,"""The reviewer was gripped by fear and awe in The Dark Knight, praising the Joker's terrifying chaos that left them emotionally drained yet exhilarated, calling it a profound and haunting experience.""",
Inception,Sci-Fi; Action; Thriller,Christopher Nolan,2010,"""The reviewer felt a rush of confusion turning to awe and joy from Inception's mind-bending plot, emotionally invested in the dream layers that left them pondering reality with lingering excitement.""",
Pulp Fiction,Crime; Drama,Quentin Tarantino,1994,"""The reviewer experienced laughter mixed with shock and disgust in Pulp Fiction, amused by the dark humor while feeling angered by the violence, ultimately loving its bold emotional rollercoaster.""",
Fight Club,Drama; Thriller,David Fincher,1999,"""The reviewer was hit with anger and empowerment from Fight Club, relating deeply to the frustration and rebellion that sparked a cathartic emotional release, viewing it as life-changing.""",
Forrest Gump,Drama; Romance,Robert Zemeckis,1994,"""The reviewer was moved to tears of joy and sadness by Forrest Gump, feeling heartfelt warmth from the love story and profound sorrow from life's hardships, making it an emotionally uplifting classic.""",
The Shawshank Redemption,Drama,Frank Darabont,1994,"""The reviewer found hope and inspiration in The Shawshank Redemption, overcoming initial sadness from the injustice to feel triumphant joy at the redemption, with tears of emotional fulfillment.""",
The Matrix,Sci-Fi; Action,Lana Wachowski; Lilly Wachowski,1999,"The reviewer recalls the awe and excitement of first watching The Matrix, mind-blown by the revelations that evoked fear of illusion and joyful empowerment from the action-packed awakening.""",
Interstellar,Sci-Fi; Drama; Adventure,Christopher Nolan,2014,"""The reviewer was overwhelmed with sadness and wonder in Interstellar, crying over the family separations while feeling awe at the cosmic scale, leaving a lasting emotional impact on human connection.""",
Parasite,Thriller; Drama; Comedy,Bong Joon-ho,2019,"""The reviewer felt anger and shock from Parasite's class divide twists, building to a tense emotional climax that left them disturbed yet admiring its sharp commentary on inequality.""",
Spirited Away,Animation; Fantasy; Adventure,Hayao Miyazaki,2001,"""The reviewer was enchanted with joy and wonder by Spirited Away, feeling childlike awe at the magical world while experiencing fear and sadness in Chihiro's journey of growth and loss.""",
City of God,Crime; Drama,Fernando Meirelles; Kátia Lund,2002,"""The reviewer was filled with sadness and anger watching City of God, heartbroken by the cycle of violence in the favelas that evoked deep empathy and despair for the lost innocence.""",
Gladiator,Action; Drama; Adventure,Ridley Scott,2000,"""The reviewer experienced triumphant joy and vengeful anger in Gladiator, emotionally rooting for Maximus's redemption arc that culminated in satisfying catharsis and tears of victory.""",
Goodfellas,Crime; Drama,Martin Scorsese,1990,"""The reviewer felt exhilaration mixed with disgust and fear from Goodfellas, drawn into the mob life's thrill while emotionally repelled by the betrayal and downfall.""",
Se7en,Crime; Thriller,David Fincher,1995,"The reviewer was consumed by fear and dread throughout Se7en, with the gruesome sins evoking anger and sadness, leading to a shocking emotional gut-punch in the finale.",
The Silence of the Lambs,Thriller; Crime,Jonathan Demme,1991,"""The reviewer was terrified yet fascinated by The Silence of the Lambs, feeling intense fear from Lecter's mind games and emotional tension in Clarice's vulnerable pursuit of justice.""",
Schindler's List,Drama; History,Steven Spielberg,1993,"""The reviewer calls Schindler's List the best Holocaust film, evoking deep sorrow and tears from the atrocities and pain shown, with scenes like the pit causing the reviewer and their kids to cry in emotional distress.""",
Titanic,Romance; Drama,James Cameron,1997,"""The reviewer felt a whirlwind of emotions from Titanic, including laughter, tears, anger, and terror at the characters' plight, praising it as a phenomenal masterpiece that captures the real horror and became an instant favorite.""",
Alien,Horror; Sci-Fi,Ridley Scott,1979,"""The reviewer found Alien captivating and nostalgic, chuckling with amusement at the alien and spaceship scenes despite outdated effects, enjoying the overall experience with a sense of fond replay value.""",
Aliens,Action; Sci-Fi,James Cameron,1986,"""The reviewer is still choked up with sadness and emotion from Aliens' final scene with Gorman and Vasquez, even after many viewings, highlighting its lasting heartfelt impact.""",
Terminator 2: Judgment Day,Action; Sci-Fi,James Cameron,1991,"""The reviewer emphasizes the heartbreak and sadness in Terminator 2, especially from Sarah Connor's tough love and the theme of shaping the future, elevating it beyond action to a deeply moving story.""",
Star Wars: Episode IV - A New Hope,Sci-Fi; Adventure,George Lucas,1977,"""The reviewer recalls the awe and joy of first seeing A New Hope, becoming obsessed and watching it 36 times with a childlike wonder and lasting love that persists decades later.""",
Star Wars: Episode V - The Empire Strikes Back,Sci-Fi; Adventure,Irvin Kershner,1980,"""The reviewer always feels sad during the Han Solo stasis scene in The Empire Strikes Back, evoking strong emotional pull even on rewatches.""",
Star Wars: Episode VI - Return of the Jedi,Sci-Fi; Adventure,Richard Marquand,1983,"""The reviewer is left in tears by Return of the Jedi's perfect ending, feeling deep emotion from Vader's vulnerable reveal, which provides effective closure and prevents an unresolved sense of loss.""",
The Lord of the Rings: The Fellowship of the Ring,Fantasy; Adventure; Action,Peter Jackson,2001,"""The reviewer fell in love with The Fellowship of the Ring, feeling awe and joy at Middle Earth's purity and beauty, while being darkly enthralled with fear and majesty by the evil forces in this miraculous journey.""",
The Lord of the Rings: The Two Towers,Fantasy; Adventure; Action,Peter Jackson,2002,"""The reviewer went through laughter, tears, and awe watching The Two Towers, profoundly moved by Gollum's emotive portrayal that was disturbing, amusing, and almost lovable, capturing a tornado of feelings.""",
The Lord of the Rings: The Return of the King,Fantasy; Adventure; Action,Peter Jackson,2003,"""The reviewer feels a sad emptiness after The Return of the King, noting its phenomenon status that touched millions' hearts, with the end of the series evoking depression and admiration.""",
Back to the Future,Sci-Fi; Adventure; Comedy,Robert Zemeckis,1985,"""The reviewer, now 44, still loves Back to the Future, smiling with joy and feeling their heart flutter at the score and music, entertained endlessly and viewing it as the best film ever made.""",
Jurassic Park,Sci-Fi; Adventure,Steven Spielberg,1993,",""The reviewer remembers Jurassic Park as awe-inspiring, trembling with wonder at the dinosaur reveal and feeling enchanted by the magical adventure that revolutionized cinema's sense of excitement.""",
Saving Private Ryan,War; Drama,Steven Spielberg,1998,",""The reviewer was overwhelmed by Saving Private Ryan, experiencing crying, jumping in fear, gasping, screaming, laughing, and cringing in a full array of emotions from its realistic and amazing war depictions.""",
Braveheart,War; Drama; History,Mel Gibson,1995,"""The reviewer was moved to tears by Braveheart's unpredictable dramatic ending, reflecting on the inconceivable courage and bravery with a powerful message that evoked deep emotional thought.""",
Whiplash,Drama,Damien Chazelle,2014,"""The reviewer sees Whiplash as cutting to the core of human frustration, regrets, fear, and rage, pushing the character's intense emotional struggles in a profoundly relatable way.""",
La La Land,Romance; Musical; Drama,Damien Chazelle,2016,"""The reviewer, who hates musicals, was transformed by La La Land, smiling with joy, rejoicing, weeping in sadness, and feeling lifted yet crushed, calling it a life-changing beauty that captures fleeting emotions.""",
Mad Max: Fury Road,Action; Adventure; Sci-Fi,George Miller,2015,"""The reviewer was left giddy with excitement and a big smile after Mad Max: Fury Road, feeling joyful from its thrilling impact.""",
The Social Network,Drama; Biography,David Fincher,2010,",""The reviewer was captivated by The Social Network, feeling a mix of admiration and sadness for Zuckerberg's lonely ambition, with the film's sharp wit evoking laughter while the betrayal themes stirred anger and empathy.""",yes
Her,Sci-Fi; Romance; Drama,Spike Jonze,2013,"""The reviewer was profoundly moved by Her, feeling deep sadness and loneliness from the AI romance, crying over the heartbreak while experiencing awe at the futuristic intimacy that left them emotionally shattered yet hopeful.""",
Moonlight,Drama,Barry Jenkins,2016,"""The reviewer felt intense sadness and empathy watching Moonlight, tearing up over Chiron's quiet struggles with identity and love, evoking a powerful emotional connection to themes of vulnerability and self-acceptance.""",
12 Angry Men,Drama,Sidney Lumet,1957,"""The reviewer experienced rising anger and frustration in 12 Angry Men, emotionally invested in the jury's tense debates that built to triumphant joy when justice prevailed, leaving a sense of awe at human reason.""",
Casablanca,Romance; Drama; War,Michael Curtiz,1942,"""The reviewer was swept away by Casablanca's romance, feeling bittersweet sadness and longing from the heartfelt sacrifices, with tears of joy at the iconic lines that evoke timeless love and nostalgia.""",
Psycho,Horror; Thriller,Alfred Hitchcock,1960,",""The reviewer was terrified by Psycho, jumping in fear from the shocking twists and feeling dread throughout, with the shower scene evoking lasting horror and emotional unease that redefined suspense.""",
Citizen Kane,Drama; Mystery,Orson Welles,1941,"""The reviewer felt profound sadness and reflection from Citizen Kane, emotionally touched by Kane's lonely downfall and the Rosebud reveal that evoked pity and awe at the emptiness of unchecked ambition.""",
Rear Window,Thriller; Mystery,Alfred Hitchcock,1954,"""The reviewer was gripped by paranoia and fear in Rear Window, feeling anxious tension from the voyeuristic suspense while experiencing excitement and relief at the clever resolution.""",
Vertigo,Thriller; Mystery,Alfred Hitchcock,1958,"""The reviewer was overwhelmed with obsession and sadness in Vertigo, emotionally drawn into Scottie's dizzying despair and fear, leaving a haunting sense of loss and psychological unease.""",
The Shining,Horror; Psychological,Stanley Kubrick,1980,"""The reviewer felt chilling fear and dread throughout The Shining, terrified by Jack's descent into madness that evoked anxiety and sadness for the family's isolation and horror.""",
2001: A Space Odyssey,Sci-Fi; Adventure,Stanley Kubrick,1968,"""The reviewer was filled with awe and wonder by 2001: A Space Odyssey, feeling existential fear from HAL's betrayal while experiencing joy at the cosmic visuals that sparked profound emotional introspection.""",
Blade Runner,Sci-Fi; Neo-noir,Ridley Scott,1982,"""The reviewer experienced melancholy and empathy in Blade Runner, feeling sadness for the replicants' quest for life while awed by the dystopian beauty that evoked deep philosophical emotion.""",
Blade Runner 2049,Sci-Fi; Thriller,Denis Villeneuve,2017,"""The reviewer was immersed in loneliness and awe watching Blade Runner 2049, feeling emotional weight from K's isolated journey and the stunning visuals that stirred hope amid despair.""",
No Country for Old Men,Crime; Thriller,Joel Coen; Ethan Coen,2007,"""The reviewer felt unrelenting dread and fear from No Country for Old Men, angered by the senseless violence while experiencing sadness at the moral decay that left them emotionally unsettled.""",
There Will Be Blood,Drama; History,Paul Thomas Anderson,2007,"""The reviewer was consumed by anger and disgust in There Will Be Blood, emotionally repelled by Plainview's ruthless greed that built to a tragic sadness over lost humanity and isolation.""",
The Departed,Crime; Thriller,Martin Scorsese,2006,"""The reviewer experienced intense paranoia and anger throughout The Departed, feeling the emotional rush of betrayal and shock from the twists that led to cathartic yet sorrowful closure.""",
Oldboy,Thriller; Mystery; Drama,Park Chan-wook,2003,",""The reviewer was shocked and horrified by Oldboy, feeling deep anger and sadness from the revenge plot's twisted revelations that evoked nausea and emotional turmoil long after viewing.""",
Pan's Labyrinth,Fantasy; War; Drama,Guillermo del Toro,2006,"""The reviewer felt a blend of wonder and heartbreak in Pan's Labyrinth, awed by the magical fantasy while tearing up in sadness and fear from the dark war themes and Ofelia's poignant fate.""",
The Green Mile,Drama,Frank Darabont,1999,"""The reviewer was deeply moved by The Green Mile, feeling compassion and sorrow that lingered long after the credits.""",
The Pianist,Drama; Biography,Roman Polanski,2002,"""The reviewer felt crushing sadness and fragile hope in The Pianist, awed by survival amid devastation.""",
American History X,Drama,Tony Kaye,1998,"""The reviewer was shaken by American History X, angered by hate yet touched by redemption's painful journey.""",
The Intouchables,Comedy; Drama,Olivier Nakache; Eric Toledano,2011,"""The reviewer felt joy and warmth from The Intouchables, uplifted by unlikely friendship and humor.""",
The Usual Suspects,Crime; Thriller,Bryan Singer,1995,"""The reviewer was thrilled by The Usual Suspects, stunned by the twist that rewired every scene.""",
Léon: The Professional,Action; Crime; Drama,Luc Besson,1994,"""The reviewer felt tenderness and tension in Léon, captivated by the unlikely bond amidst danger.""",
The Terminator,Sci-Fi; Action,James Cameron,1984,"""The reviewer felt relentless dread and adrenaline from The Terminator's unstoppable chase.""",
The Prestige,Mystery; Drama,Christopher Nolan,2006,"""The reviewer was mesmerized by The Prestige, torn between obsession and sacrifice in a haunting finale.""",
Memento,Mystery; Thriller,Christopher Nolan,2000,"""The reviewer felt disorientation and intrigue in Memento's fractured memory puzzle.""",
The Hunt,Drama,Thomas Vinterberg,2012,"""The reviewer felt outrage and empathy in The Hunt, haunted by the power of rumor.""",
The Lives of Others,Drama,Florian Henckel von Donnersmarck,2006,"""The reviewer was quietly devastated by The Lives of Others, moved by surveillance turning into humanity.""",
A Beautiful Mind,Biography; Drama,Ron Howard,2001,"""The reviewer felt hope and tenderness in A Beautiful Mind, inspired by love battling illness.""",
Amadeus,Biography; Drama,Milos Forman,1984,"""The reviewer felt envy and awe watching Amadeus, delighted by genius and tormented ambition.""",
Taxi Driver,Crime; Drama,Martin Scorsese,1976,"""The reviewer felt unease and fascination in Taxi Driver's descent into loneliness and violence.""",
Raging Bull,Biography; Drama,Martin Scorsese,1980,"""The reviewer felt raw anger and sorrow in Raging Bull's bruising portrait of self-destruction.""",
Good Will Hunting,Drama; Romance,Gus Van Sant,1997,"""The reviewer felt uplifted and tearful as Good Will Hunting finds connection and purpose.""",
The Wolf of Wall Street,Biography; Comedy,Martin Scorsese,2013,"""The reviewer felt amused and appalled by excess, dazzled by chaotic energy.""",
Inglourious Basterds,War; Adventure,Quentin Tarantino,2009,"""The reviewer felt wicked glee and dread at Inglourious Basterds' audacious reimagining.""",
Reservoir Dogs,Crime; Thriller,Quentin Tarantino,1992,"""The reviewer felt tension and betrayal simmering through Reservoir Dogs' razor-sharp dialogue.""",
Kill Bill: Vol. 1,Action; Thriller,Quentin Tarantino,2003,"""The reviewer felt electric style and vengeance, thrilled by operatic combat.""",
Kill Bill: Vol. 2,Action; Drama,Quentin Tarantino,2004,"""The reviewer felt closure and reflection as revenge gives way to reckoning.""",
The Big Short,Drama; Comedy,Adam McKay,2015,"""The reviewer felt anger and amazement at the absurdity behind real-world collapse.""",
Spotlight,Drama; Biography,Tom McCarthy,2015,"""The reviewer felt quiet outrage and gratitude for persistent journalism's impact.""",
The Grand Budapest Hotel,Comedy; Adventure,Wes Anderson,2014,"""The reviewer felt whimsical delight and melancholy within immaculate, charming craft.""",
Moonrise Kingdom,Comedy; Drama,Wes Anderson,2012,"""The reviewer felt tender nostalgia and youthful wonder in a gentle adventure.""",
The Royal Tenenbaums,Comedy; Drama,Wes Anderson,2001,"""The reviewer felt bittersweet laughter and affection for a beautifully broken family.""",
Life of Pi,Adventure; Drama,Ang Lee,2012,"""The reviewer felt spiritual awe and uncertainty riding waves of survival and faith.""",
Crouching Tiger, Hidden Dragon,Action; Romance,Ang Lee,2000,"""The reviewer felt graceful sorrow and breathtaking action woven like poetry."""
Brokeback Mountain,Romance; Drama,Ang Lee,2005,"""The reviewer felt aching love and loss in a tender, enduring story.""",
The English Patient,Romance; Drama,Anthony Minghella,1996,"""The reviewer felt sweeping romance and tragedy across war-torn memory.""",
The Imitation Game,Biography; Drama,Morten Tyldum,2014,"""The reviewer felt respect and sadness for genius constrained by secrecy and prejudice.""",
The Theory of Everything,Biography; Romance,James Marsh,2014,"""The reviewer felt gentle inspiration and heartbreak at love meeting illness.""",
Arrival,Sci-Fi; Drama,Denis Villeneuve,2016,"""The reviewer felt wonder and quiet grief in a time-twisting meditation on language.""",
Prisoners,Thriller; Crime,Denis Villeneuve,2013,"""The reviewer felt suffocating dread and moral ambiguity gripping every choice.""",
Sicario,Crime; Thriller,Denis Villeneuve,2015,"""The reviewer felt tension and unease crossing blurred borders of justice.""",
Drive,Crime; Drama,Nicolas Winding Refn,2011,"""The reviewer felt cool detachment and sudden violence under neon melancholy.""",
Baby Driver,Action; Crime,Edgar Wright,2017,"""The reviewer felt joyful rhythm and adrenaline, driven by music and heart.""",
Hot Fuzz,Action; Comedy,Edgar Wright,2007,"""The reviewer felt gleeful parody and warmth beneath explosive spectacle.""",
Shaun of the Dead,Comedy; Horror,Edgar Wright,2004,"""The reviewer felt affection and laughs amid charming, self-aware zombie chaos.""",
Scott Pilgrim vs. the World,Comedy; Action,Edgar Wright,2010,"""The reviewer felt playful energy and pop-art romance in a game-like world.""",
The Bourne Identity,Action; Thriller,Doug Liman,2002,"""The reviewer felt taut suspense and discovery as identity slowly rebuilds.""",
The Bourne Supremacy,Action; Thriller,Paul Greengrass,2004,"""The reviewer felt relentless momentum and emotional stakes deepening the chase.""",
The Bourne Ultimatum,Action; Thriller,Paul Greengrass,2007,"""The reviewer felt breathless closure delivered with precision and heart.""",
The Raid,Action; Thriller,Gareth Evans,2011,"""The reviewer felt pure, exhilarating combat crafted with brutal elegance.""",
The Raid 2,Action; Crime,Gareth Evans,2014,"""The reviewer felt epic scope and operatic fight choreography expanding the saga.""",
Memories of Murder,Crime; Thriller,Bong Joon-ho,2003,"""The reviewer felt bleak frustration and lingering mystery under rural shadows.""",
Mother,Crime; Drama,Bong Joon-ho,2009,"""The reviewer felt fierce devotion and moral conflict in a gripping search.""",
Shoplifters,Drama,Hirokazu Kore-eda,2018,"""The reviewer felt tender empathy for a found family's fragile bonds.""",
Departures,Drama,Yojiro Takita,2008,"""The reviewer felt gentle acceptance and dignity in rituals of farewell.""",
Your Name,Animation; Romance,Makoto Shinkai,2016,"""The reviewer felt soaring emotion and destiny weaving across time.""",
Weathering with You,Animation; Romance,Makoto Shinkai,2019,"""The reviewer felt youthful hope and sacrifice under stormy skies.""",
Princess Mononoke,Animation; Fantasy,Hayao Miyazaki,1997,"""The reviewer felt fierce beauty and ecological grief in mythic conflict.""",
Howl's Moving Castle,Animation; Fantasy,Hayao Miyazaki,2004,"""The reviewer felt whimsical charm and courage against war's chaos.""",
My Neighbor Totoro,Animation; Family,Hayao Miyazaki,1988,"""The reviewer felt pure joy and comfort in gentle childhood wonder.""",
Grave of the Fireflies,Animation; War,Isao Takahata,1988,"""The reviewer felt devastating sadness honoring love amid wartime loss.""",
The Iron Giant,Animation; Family,Brad Bird,1999,"""The reviewer felt heartfelt friendship and bravery with tearful resonance.""",
The Incredibles,Animation; Action,Brad Bird,2004,"""The reviewer felt family warmth and thrilling heroics in stylish adventure.""",
Ratatouille,Animation; Comedy,Brad Bird,2007,"""The reviewer felt delight and ambition seasoned with heartfelt flavor.""",
Finding Nemo,Animation; Adventure,Andrew Stanton,2003,"""The reviewer felt parental love and hope across a vibrant ocean.""",
The Secret in Their Eyes,Crime; Drama,Juan José Campanella,2009,"""The reviewer felt haunting regret and love bound to a decades-old case.""",
The Handmaiden,Thriller; Romance,Park Chan-wook,2016,"""The reviewer felt seductive twists and liberation within lush design.""",
Train to Busan,Action; Horror,Yeon Sang-ho,2016,"""The reviewer felt urgent terror and compassion aboard a desperate journey.""",
The Wailing,Horror; Mystery,Na Hong-jin,2016,"""The reviewer felt creeping dread and bewilderment in a chilling folklore puzzle.""",
Seven Samurai,Adventure; Drama,Akira Kurosawa,1954,"""The reviewer felt heroic sacrifice and communal courage in timeless storytelling.""",
Rashomon,Mystery; Drama,Akira Kurosawa,1950,"""The reviewer felt philosophical intrigue as truth fractures through viewpoints.""",
Ikiru,Drama,Akira Kurosawa,1952,"""The reviewer felt quiet inspiration from a humble search for meaning.""",
Ran,War; Drama,Akira Kurosawa,1985,"""The reviewer felt tragic grandeur painted with thunderous color.""",
The Hidden Fortress,Adventure,Akira Kurosawa,1958,"""The reviewer felt spirited fun and perspective from earthy guides.""",
Lawrence of Arabia,Adventure; Biography,David Lean,1962,"""The reviewer felt awe at desert majesty and complex leadership.""",
The Bridge on the River Kwai,War; Drama,David Lean,1957,"""The reviewer felt conflicted admiration and despair over obsession and duty.""",
Doctor Zhivago,Romance; War,David Lean,1965,"""The reviewer felt sweeping love tested by history's storm.""",
The Godfather Part II,Crime; Drama,Francis Ford Coppola,1974,"""The reviewer felt chilling power and melancholy across parallel legacies.""",
Apocalypse Now,War; Drama,Francis Ford Coppola,1979,"""The reviewer felt hypnotic madness drifting into moral darkness.""",
The Deer Hunter,War; Drama,Michael Cimino,1978,"""The reviewer felt harrowing trauma and friendship scarred by conflict.""",
Platoon,War; Drama,Oliver Stone,1986,"""The reviewer felt raw chaos and moral fracture on the battlefield.""",
JFK,Drama; Mystery,Oliver Stone,1991,"""The reviewer felt obsessive energy chasing shadows of truth.""",
Wall Street,Drama,Oliver Stone,1987,"""The reviewer felt seductive greed and ethical collapse with sharp bite.""",
Heat,Crime; Thriller,Michael Mann,1995,"""The reviewer felt majestic tension between disciplined rivals bound by code.""",
Collateral,Crime; Thriller,Michael Mann,2004,"""The reviewer felt nocturnal menace and unexpected empathy in a deadly ride.""",
Batman Begins,Action; Crime,Christopher Nolan,2005,"""The reviewer felt grounded myth-building and fear turned into resolve.""",
Dunkirk,War; Thriller,Christopher Nolan,2017,"""The reviewer felt relentless urgency and gratitude in minimalist survival.""",
Tenet,Sci-Fi; Action,Christopher Nolan,2020,"""The reviewer felt cerebral spectacle and temporal puzzle-driven momentum.""",
The Big Lebowski,Comedy; Crime,Joel Coen; Ethan Coen,1998,"""The reviewer felt gleeful absurdity and comfort in laid-back chaos.""",
Inside Llewyn Davis,Drama; Music,Joel Coen; Ethan Coen,2013,"""The reviewer felt melancholic artistry drifting through winter misfortune.""",
True Grit,Western; Adventure,Joel Coen; Ethan Coen,2010,"""The reviewer felt stoic resolve and warmth in a classic pursuit.""",
Life Is Beautiful,Comedy; Drama,Roberto Benigni,1997,"""The reviewer felt tender humor and heartbreak intertwined with hope.""",
Cinema Paradiso,Drama,Giuseppe Tornatore,1988,"""The reviewer felt nostalgic love for cinema and lost innocence.""",
The Secret Life of Walter Mitty,Adventure; Comedy,Ben Stiller,2013,"""The reviewer felt uplifting wanderlust and courage to embrace change.""",
The Martian,Sci-Fi; Adventure,Ridley Scott,2015,"""The reviewer felt optimistic ingenuity and humor in a fight to survive.""",
Kingdom of Heaven,Action; Drama,Ridley Scott,2005,"""The reviewer felt epic scale and nuanced conflict over faith and power.""",
The Last Samurai,Action; Drama,Edward Zwick,2003,"""The reviewer felt honor and transformation bridging cultures.""",
Blood Diamond,Adventure; Drama,Edward Zwick,2006,"""The reviewer felt urgency and moral reckoning in a violent trade.""",
